<?xml version="1.0" encoding="ISO-8859-1"?>

<!ELEMENT krama-config    (js, css, views?, ajax-call?, js-dependencies?)>
		  <!--xmlns CDATA #FIXED "http:///kramaframework.org/Configuration"--> 

<!ELEMENT js EMPTY>
<!ATTLIST js 
	        location CDATA #REQUIRED>

<!ELEMENT css EMPTY>
<!ATTLIST css 
	        location CDATA #REQUIRED>

<!ELEMENT views (view*)>
<!ELEMENT view (#PCDATA) >
<!ATTLIST view  
		name NMTOKEN #REQUIRED
		class ID #REQUIRED>

<!ELEMENT ajax-call (class*)>
<!ELEMENT class (method+) >
<!ATTLIST class 
		name NMTOKEN #REQUIRED
		class ID #REQUIRED>
<!ELEMENT method (param*) >
<!ATTLIST method 
		name NMTOKEN #REQUIRED
		method NMTOKEN #REQUIRED>

<!ELEMENT param (#PCDATA) >
<!ATTLIST param 
		type (java.lang.Boolean|java.lang.Long|java.lang.String|java.lang.Float|java.lang.Double|java.lang.Integer|java.lang.Byte|java.lang.Character|java.lang.Short) #REQUIRED>

<!ELEMENT js-dependencies (js-dependency*)>
<!ELEMENT js-dependency (name, file, version?)>
<!ELEMENT name (#PCDATA) >
<!ELEMENT file (#PCDATA) >
<!ELEMENT version (#PCDATA) >
